{
  "slug": "india-women-vs-pakistan-asia-cup-2026-result",
  "seoTitle": "India Women Beat Pakistan by 7 Wickets in Asia Cup 2026",
  "headline": "India Women Crush Pakistan by 7 Wickets in Women's Asia Cup 2026",
  "metaDescription": "India Women bowled Pakistan out for 55 before chasing the target in 8.4 overs to win by seven wickets in the Women's Asia Cup 2026 in Dubai.",
  "categoryLabel": "India Women • Women's Asia Cup 2026",
  "filterCategories": [
    "india",
    "icc"
  ],
  "articleType": "news",
  "deck": "India's spinners dismantled Pakistan for 55 before Harmanpreet Kaur and Deepti Sharma completed a rapid chase to seal a commanding seven-wicket victory in Dubai.",
  "publicationDatetime": "2026-09-05T22:15:00+05:30",
  "heroImageFilename": "india-women-vs-pakistan-asia-cup-2026-result-cricxz.webp",
  "heroImageAlt": "CricXZ editorial graphic for India's seven-wicket victory over Pakistan in the Women's Asia Cup 2026",
  "heroImageWidth": 1536,
  "heroImageHeight": 1024,
  "sourceCutoff": "Information checked through 5 September 2026 after the match.",
  "articleBodyHtml": "<p>India Women produced one of the most dominant performances of the Women's Asia Cup 2026 as they defeated Pakistan Women by seven wickets at the Dubai International Cricket Stadium on 5 September. Pakistan were bowled out for just 55 in 18.1 overs before India raced to 57 for three in only 8.4 overs, completing the chase with 68 balls remaining.</p>\n\n<p>The result gave India a third consecutive victory in Group A after earlier wins over Thailand and Hong Kong, China. It also completed an unbeaten group-stage campaign for Harmanpreet Kaur's side and underlined India's strength with both spin bowling and batting depth ahead of the knockout phase.</p>\n\n<h2>India Women vs Pakistan Women: match result</h2>\n<p>Pakistan won the toss and chose to bat first, but the innings quickly unravelled against India's spin attack. Wickets fell at regular intervals and Pakistan never managed to build a meaningful partnership.</p>\n<p>Pakistan were eventually dismissed for 55 in 18.1 overs. India then chased the target in 8.4 overs, finishing on 57 for three to seal victory by seven wickets.</p>\n<p>The margin of victory reflected India's control of the match. With a modest target required, the chase never demanded sustained risk and India were able to complete the contest with more than half of their allotted overs unused.</p>\n\n<h2>Pakistan collapse under pressure from India's spinners</h2>\n<p>The decisive phase of the match came during Pakistan's innings. India's spinners applied immediate pressure, restricting scoring opportunities while continuing to take wickets.</p>\n<p>Shree Charani and Prema Rawat were the leading wicket-takers for India, claiming three wickets each. Charani finished with three for seven from four overs, while Rawat returned three for nine from her four-over spell.</p>\n<p>Pakistan's top order struggled to recover from the early damage. Shawaal Zulfiqar finished as the team's highest scorer with 14 from 14 balls, while Muneeba Ali made 13 from 15. No Pakistan batter was able to produce the longer innings needed to rebuild the total.</p>\n\n<h2>Shree Charani and Prema Rawat lead the bowling attack</h2>\n<p>India's victory was built around a disciplined spin-bowling performance. Charani and Rawat combined for six wickets while conceding only 16 runs across their eight overs.</p>\n<p>Their ability to attack the stumps, control the scoring rate and maintain pressure left Pakistan with little room to recover. The performance also demonstrated the depth available to India beyond its more established bowling names.</p>\n<p>For India, that depth could be particularly important in the knockout stage, where conditions in Dubai may continue to reward bowlers capable of varying pace and using the surface effectively.</p>\n\n<h2>India lose three wickets but finish chase comfortably</h2>\n<p>Pakistan captain Fatima Sana gave her side a brief opening during India's chase by taking all three wickets to fall. She finished with three wickets for 17 runs from three overs.</p>\n<p>Shafali Verma contributed a quick 12 from six balls, helping India move rapidly towards the small target. Despite Pakistan's wickets, the required total was never large enough to create sustained pressure.</p>\n<p>Captain Harmanpreet Kaur remained unbeaten on 18 from 18 balls, while Deepti Sharma was unbeaten on 12 from 14. The pair took India past the target at 57 for three in the ninth over.</p>\n\n<h2>India complete perfect Group A campaign</h2>\n<p>The Pakistan victory continued India's unbeaten run in the Women's Asia Cup 2026. India had opened the tournament by defeating Thailand by 94 runs before producing an even bigger 137-run victory against Hong Kong, China.</p>\n<p>Smriti Mandhana was the headline performer in the Hong Kong, China match, scoring 124 from 64 balls. That innings took her to 10,880 international runs and 18 international centuries, both major milestones in women's international cricket.</p>\n<p>India's win over Pakistan made it three victories from three Group A matches. With the top two teams from each group advancing to the semi-finals, India ended their group programme in a commanding position and with significant momentum heading into the knockout stage.</p>\n\n<h2>Pakistan's batting problems prove costly</h2>\n<p>Pakistan entered the match after defeating Thailand by 35 runs in their opening fixture, but their batting was unable to withstand India's sustained pressure.</p>\n<p>Muneeba Ali had scored 54 against Thailand and was again one of the few Pakistan batters to reach double figures against India. However, regular wickets prevented Pakistan from establishing the partnerships required to post a competitive total.</p>\n<p>The performance means Pakistan must quickly regroup for the remainder of their Group A campaign as the race for the second semi-final place continues.</p>\n\n<h2>India's bowling depth sends strong knockout message</h2>\n<p>While India's batting had attracted much of the attention earlier in the competition, particularly after Mandhana's record-breaking century, the Pakistan match highlighted the team's bowling resources.</p>\n<p>Restricting an international opponent to 55 demonstrated India's ability to control a game even when its leading batters are not required to produce a major score. Charani and Rawat's combined six wickets were central to that performance.</p>\n<p>The balance between attacking batting and multiple bowling options gives India several ways to influence matches as the tournament moves towards its decisive stage.</p>\n\n<h2>Three very different wins for India</h2>\n<p>India's three Group A victories have arrived in different circumstances. Against Thailand, Shafali Verma's attacking innings helped establish a strong total before the bowlers completed a 94-run win.</p>\n<p>Against Hong Kong, China, Mandhana's 124 powered India to 193 for five and a 137-run victory. Against Pakistan, it was the bowlers who dictated the contest by dismissing the opposition for 55 before the target was chased inside nine overs.</p>\n<p>That variety is an encouraging sign for India because tournament cricket often requires teams to adapt quickly to different match situations rather than depend on a single player or method of winning.</p>\n\n<h2>What happens next for India</h2>\n<p>India can now turn its attention to the semi-finals after completing its Group A schedule without defeat. The knockout stage will bring greater pressure, but the team enters it after three convincing performances in Dubai.</p>\n<p>The challenge will be to carry that form into the semi-final while continuing to make effective use of both its aggressive top order and its increasingly influential spin attack.</p>\n<p>For Pakistan, the focus shifts to securing the results required to remain in contention for the other Group A semi-final position.</p>",
  "sources": [
    {
      "label": "ICC — All the squads at the Women's Asia Cup 2026",
      "url": "https://www.icc-cricket.com/news/all-the-squads-at-the-women-s-asia-cup-2026"
    },
    {
      "label": "ICC — Pakistan off to a winning start in Asia Cup",
      "url": "https://www.icc-cricket.com/news/pakistan-off-to-a-winning-start-in-asia-cup"
    },
    {
      "label": "ICC — Deepti wary of Pakistan challenge in Asia Cup",
      "url": "https://www.icc-cricket.com/news/deepti-wary-of-pakistan-challenge-in-asia-cup"
    },
    {
      "label": "Indian Express — India spinners blow Pakistan away for 55",
      "url": "https://indianexpress.com/article/sports/cricket/india-pakistan-womens-asia-cup-2026-record-lowest-total-55-all-out-10864905/"
    }
  ],
  "relatedArticles": [
    {
      "title": "India Women vs Pakistan Women: Asia Cup 2026 Preview",
      "url": "articles/india-women-vs-pakistan-women-asia-cup-2026-preview.html"
    },
    {
      "title": "Mandhana's Record 124 Powers India Past Hong Kong, China",
      "url": "articles/smriti-mandhana-124-india-hong-kong-asia-cup-2026.html"
    },
    {
      "title": "India Women Open Asia Cup 2026 With Win Over Thailand",
      "url": "articles/india-women-asia-cup-2026-thailand-win-hong-kong-next.html"
    }
  ],
  "cardHeadline": "India Women Crush Pakistan by 7 Wickets",
  "cardSummary": "India bowled Pakistan out for 55 before completing the chase in just 8.4 overs to seal their third straight Asia Cup victory.",
  "homepageFeatured": true
}