{
  "slug": "womens-asia-cup-2026-group-a-india-pakistan-semifinal-race",
  "seoTitle": "Women's Asia Cup 2026: India Top Group A, Pakistan Semi-final Race",
  "headline": "Women's Asia Cup 2026: India Top Group A as Pakistan Face Semi-final Race",
  "metaDescription": "India finish unbeaten at the top of Group A in the Women's Asia Cup 2026, while Pakistan face Hong Kong, China in a crucial final group match.",
  "categoryLabel": "Women's Asia Cup 2026 • Group A",
  "filterCategories": ["india", "icc"],
  "articleType": "news",
  "deck": "India have completed an unbeaten Group A campaign and secured a semi-final place, while Pakistan's final match against Hong Kong, China will shape the remaining qualification race.",
  "publicationDatetime": "2026-09-06T08:30:00+05:30",
  "heroImageFilename": "womens-asia-cup-2026-group-a-india-pakistan-semifinal-race-cricxz.webp",
  "heroImageAlt": "CricXZ editorial graphic showing India at the top of Women's Asia Cup 2026 Group A and Pakistan in the semi-final race",
  "heroImageWidth": 1536,
  "heroImageHeight": 1024,
  "sourceCutoff": "Information checked through 6 September 2026.",
  "articleBodyHtml": "<p>India Women have completed an unbeaten Group A campaign at the Women's Asia Cup 2026 and secured their place in the semi-finals after three convincing victories in Dubai. Harmanpreet Kaur's side followed wins over Thailand and Hong Kong, China with a seven-wicket victory against Pakistan on 5 September to remain at the top of the group.</p>\n\n<p>While India's qualification is already secure, the battle around the remaining Group A semi-final place continues. Pakistan are scheduled to face Hong Kong, China on 7 September in their final group fixture, giving Fatima Sana's side an important opportunity to strengthen their qualification position.</p>\n\n<h2>India finish Group A unbeaten</h2>\n<p>India have produced three very different but convincing performances during the group stage. They opened their campaign with a 94-run victory over Thailand before defeating Hong Kong, China by 137 runs.</p>\n<p>The third victory came against Pakistan, when India's bowlers dismissed their opponents for 55 before the target was chased in only 8.4 overs for the loss of three wickets.</p>\n<p>That result ensured India remained undefeated through their three Group A matches and confirmed their place in the semi-finals.</p>\n\n<h2>How India reached the Women's Asia Cup semi-finals</h2>\n<p>India's route to the knockout stage has highlighted the team's ability to win matches in different ways. Shafali Verma played a major role against Thailand, while Smriti Mandhana produced a record-breaking century against Hong Kong, China.</p>\n<p>Mandhana scored 124 from 64 balls as India reached 193 for five against Hong Kong, China. Her innings took her past Mithali Raj to become the leading run-scorer in women's international cricket and also moved her to 18 international centuries.</p>\n<p>Against Pakistan, India's bowling depth took centre stage. Pakistan were dismissed for their lowest-ever Women's T20I total of 55 before India completed a comfortable seven-wicket victory.</p>\n\n<h2>Pakistan remain in the Group A qualification race</h2>\n<p>Pakistan began their tournament with a 35-run victory over Thailand before suffering their first defeat of the competition against India.</p>\n<p>Following the India match, Pakistan had two points from two outings and were second on the Group A table according to the Pakistan Cricket Board's post-match update.</p>\n<p>Their final group fixture is against Hong Kong, China on 7 September at the Dubai International Cricket Stadium. The result will be important to the final shape of the Group A qualification picture.</p>\n\n<h2>Pakistan vs Hong Kong, China becomes crucial</h2>\n<p>Pakistan will enter their final group match looking to respond immediately after the heavy defeat against India. Their batting will be one of the main areas of focus after being bowled out for 55.</p>\n<p>Muneeba Ali had earlier scored 54 against Thailand and helped Pakistan recover from a difficult start in that match. Pakistan will again look to their experienced batters and captain Fatima Sana as they attempt to finish the group stage strongly.</p>\n<p>Hong Kong, China, led by Natasha Miles, are competing in Group A alongside India, Pakistan and Thailand. Their meeting with Pakistan is scheduled for 7 September in Dubai.</p>\n\n<h2>Why India's qualification matters</h2>\n<p>Securing qualification before the completion of the remaining Group A fixture allows India to turn their attention towards the knockout stage.</p>\n<p>The team has already demonstrated considerable balance during the tournament. India's top order has produced aggressive innings, while the spin attack has repeatedly controlled opposition batting line-ups.</p>\n<p>That combination was particularly evident against Pakistan, where Shree Charani and Prema Rawat claimed three wickets each. Charani was named Player of the Match after returning figures of three for seven.</p>\n\n<h2>Shafali Verma reaches 3,000 T20I runs</h2>\n<p>The victory over Pakistan also produced another milestone for India. Shafali Verma crossed 3,000 runs in T20 international cricket during the opening over of India's chase.</p>\n<p>She began the innings by striking the first delivery for six and contributed 12 from six balls as India attacked the small target immediately.</p>\n<p>The milestone added another notable achievement to an India campaign that has already included Mandhana rewriting major records in women's international cricket.</p>\n\n<h2>Women's Asia Cup 2026 semi-final format</h2>\n<p>The Women's Asia Cup 2026 features eight teams divided into two groups. India, Pakistan, Hong Kong, China and Thailand make up Group A, while Sri Lanka, Bangladesh, Indonesia and hosts United Arab Emirates form Group B.</p>\n<p>The top two teams from each group qualify for the semi-finals. The two semi-finals are scheduled for 10 and 11 September, with the tournament final scheduled for 13 September.</p>\n<p>All matches in the tournament are being played at the Dubai International Cricket Stadium.</p>\n\n<h2>What happens next in Group A</h2>\n<p>India's group-stage work is complete and the team can now prepare for the semi-finals. Their three-match winning run gives them strong momentum heading into the knockout phase.</p>\n<p>Attention in Group A now turns to Pakistan's meeting with Hong Kong, China on 7 September. That match will help determine the final qualification picture alongside the completed results elsewhere in the group.</p>\n<p>For India, the immediate challenge is to carry the form and balance shown during the group stage into the higher-pressure knockout matches.</p>",
  "sources": [
    {
      "label": "ICC — Clinical India defeat Pakistan to stay unbeaten in Asia Cup",
      "url": "https://www.icc-cricket.com/news/clinical-india-defeat-pakistan-to-stay-unbeaten-in-asia-cup"
    },
    {
      "label": "ICC — All the squads at the Women's Asia Cup 2026",
      "url": "https://www.icc-cricket.com/news/all-the-squads-at-the-women-s-asia-cup-2026"
    },
    {
      "label": "ICC — Mandhana smashes multiple records with spectacular ton",
      "url": "https://www.icc-cricket.com/news/mandhana-surpasses-historic-milestones-in-asia-cup"
    },
    {
      "label": "PCB — India beat Pakistan by seven wickets in ACC Women's T20 Asia Cup",
      "url": "https://www.pcb.com.pk/news-detail/india-beat-pakistan-by-seven-wickets-in-acc-women-s-t20-asia-cup.html"
    }
  ],
  "relatedArticles": [
    {
      "title": "India Women Crush Pakistan by 7 Wickets in Women's Asia Cup 2026",
      "url": "articles/india-women-vs-pakistan-asia-cup-2026-result.html"
    },
    {
      "title": "Mandhana's Record 124 Powers India Past Hong Kong, China",
      "url": "articles/smriti-mandhana-124-india-hong-kong-asia-cup-2026.html"
    },
    {
      "title": "India Women Open Asia Cup 2026 With Win Over Thailand",
      "url": "articles/india-women-asia-cup-2026-thailand-win-hong-kong-next.html"
    }
  ],
  "cardHeadline": "India Top Asia Cup Group A as Pakistan Face Semi-final Race",
  "cardSummary": "India complete an unbeaten Group A campaign while Pakistan prepare for a crucial final fixture against Hong Kong, China.",
  "homepageFeatured": true
}