{
  "slug": "india-women-beat-japan-asian-games-2026-semifinal",
  "seoTitle": "India Women Beat Japan, Reach Asian Games 2026 Semi-final",
  "headline": "India Women Beat Japan by 8 Wickets to Reach Asian Games 2026 Semi-final",
  "metaDescription": "India Women bowled Japan out for 57 and chased the target inside five overs as Sree Charani took 4/10 and Shafali Verma struck an unbeaten 40.",
  "categoryLabel": "Asian Games 2026 • Women's Cricket",
  "filterCategories": [
    "india",
    "icc"
  ],
  "articleType": "match-report",
  "deck": "Sree Charani returned 4/10 before Shafali Verma's unbeaten 40 from 15 balls powered India into the women's cricket semi-finals in Nisshin.",
  "publicationDatetime": "2026-09-18T23:00:00+05:30",
  "heroImageFilename": "india-women-beat-japan-asian-games-2026-semifinal-cricxz.webp",
  "heroImageAlt": "Original CricXZ editorial illustration of India Women batting and bowling during the Asian Games in Japan",
  "heroImageWidth": 1536,
  "heroImageHeight": 1024,
  "heroImageCaption": "Original CricXZ editorial illustration for India's Asian Games 2026 victory over Japan.",
  "sourceCutoff": "Match details checked through 18 September 2026 after India's group-stage victory in Nisshin.",
  "articleBodyHtml": "<p>India Women advanced to the Asian Games 2026 cricket semi-finals with an eight-wicket victory over hosts Japan in Nisshin on 18 September.</p>\n\n<p>India dismissed Japan for 57 before completing the chase inside five overs. Sree Charani led the bowling effort with four wickets, while Shafali Verma finished unbeaten on 40 from 15 balls.</p>\n\n<h2>India Women vs Japan score summary</h2>\n<p><strong>Japan Women:</strong> 57 all out</p>\n<p><strong>India Women:</strong> 58/2 in under five overs</p>\n<p><strong>Result:</strong> India Women won by eight wickets</p>\n<p><strong>Venue:</strong> Nisshin, Japan</p>\n<p><strong>Date:</strong> 18 September 2026</p>\n\n<h2>Sree Charani takes 4/10</h2>\n<p>Japan found nine runs from Charani's opening over, but the left-arm spinner responded decisively. She conceded only one more run across her remaining three overs and completed figures of 4/10 from four overs.</p>\n\n<p>Charani delivered 20 dot balls in her spell, preventing Japan from building momentum and creating steady pressure through the middle of the innings.</p>\n\n<h2>India's spinners control Japan's innings</h2>\n<p>Shafali supported Charani with two wickets in consecutive deliveries and finished with 2/13. Deepti Sharma took 1/14, while Shreyanka Patil returned 1/8.</p>\n\n<p>The four spinners accounted for eight wickets between them as Japan were bowled out for 57. India therefore needed fewer than three runs per over to secure a place in the final four.</p>\n\n<h2>Shafali Verma completes the chase</h2>\n<p>India lost G Kamalini for a two-ball duck, but Shafali immediately removed any pressure from the chase. She struck six fours and two sixes in her unbeaten 40 from only 15 deliveries.</p>\n\n<p>Her attacking innings carried India past the target inside five overs and completed an influential all-round performance after her two wickets with the ball.</p>\n\n<h2>India to face Bangladesh in the semi-final</h2>\n<p>The victory secured India's place in the Asian Games semi-finals, where they are scheduled to meet Bangladesh on 20 September.</p>\n\n<p>India enter the knockout stage with recent success behind them after winning the <a href=\"india-women-win-asia-cup-2026-title.html\">Women's Asia Cup 2026 title</a>. Shafali's match-winning contribution in Nisshin also continued the strong form documented in her <a href=\"../pages/shafali-verma.html\">CricXZ player profile</a>.</p>\n\n<p>Sri Lanka also progressed to the semi-finals and will face Pakistan in the other last-four match.</p>",
  "sources": [
    {
      "label": "ICC — Sri Lanka and India advance to Asian Games semi-finals",
      "url": "https://www.icc-cricket.com/news/sri-lanka-and-india-advance-to-asian-games-semi-finals"
    }
  ],
  "relatedArticles": [
    {
      "title": "India Women Win Record Eighth Asia Cup Title",
      "url": "articles/india-women-win-asia-cup-2026-title.html"
    },
    {
      "title": "India Women Beat Bangladesh to Reach the Asia Cup Final",
      "url": "articles/india-women-vs-bangladesh-asia-cup-2026-semifinal-preview.html"
    },
    {
      "title": "Shafali Verma Profile and International Career Stats",
      "url": "pages/shafali-verma.html"
    }
  ],
  "cardHeadline": "India Women Beat Japan to Reach Asian Games Semi-final",
  "cardSummary": "Sree Charani took 4/10 before Shafali Verma hit an unbeaten 40 from 15 balls in India's eight-wicket win.",
  "homepageFeatured": true
}
