{
  "slug": "smriti-mandhana-124-india-hong-kong-asia-cup-2026",
  "seoTitle": "Mandhana 124 Powers India Past Hong Kong in Asia Cup 2026",
  "headline": "Smriti Mandhana's Record 124 Powers India Past Hong Kong, China in Women's Asia Cup 2026",
  "metaDescription": "Smriti Mandhana smashed 124 off 64 balls as India beat Hong Kong, China in the Women's Asia Cup 2026 while rewriting major international batting records.",
  "categoryLabel": "India Women • Women's Asia Cup 2026",
  "filterCategories": [
    "india",
    "icc"
  ],
  "articleType": "match-report",
  "deck": "Smriti Mandhana produced a record-breaking century as India made it two wins from two in Group A of the Women's Asia Cup 2026.",
  "publicationDatetime": "2026-09-04T08:10:00+05:30",
  "heroImageFilename": "smriti-mandhana-124-india-hong-kong-asia-cup-2026-cricxz.webp",
  "heroImageAlt": "CricXZ editorial graphic highlighting Smriti Mandhana's 124 against Hong Kong, China in the Women's Asia Cup 2026",
  "heroImageWidth": 1536,
  "heroImageHeight": 1024,
  "heroImageCaption": "CricXZ editorial graphic celebrating Smriti Mandhana's record-breaking 124 against Hong Kong, China in the Women's Asia Cup 2026.",
  "sourceCutoff": "Information checked through 4 September 2026.",
  "articleBodyHtml": "<p>Smriti Mandhana delivered one of the standout innings of the Women's Asia Cup 2026 as India defeated Hong Kong, China to register their second consecutive victory in Group A.</p>\n\n<h2>Mandhana takes charge with a record-breaking 124</h2>\n<p>Asked to bat first, India were given a strong platform by Mandhana and Shafali Verma, who added 74 runs for the opening wicket from 47 balls. Once Shafali was dismissed, Mandhana continued to dominate the innings and ensured India maintained momentum despite regular wickets at the other end.</p>\n<p>The left-hander struck 124 from just 64 deliveries, hitting 14 fours and seven sixes. No other India batter went beyond 11, making Mandhana's contribution the defining feature of the innings as India finished on 193 for five from their 20 overs.</p>\n\n<h2>Historic milestones for Mandhana</h2>\n<p>The century also carried major historical significance. Mandhana moved to 10,880 runs across international cricket, surpassing former India captain Mithali Raj's tally of 10,868 to become the leading run-scorer in women's international cricket.</p>\n<p>It was also Mandhana's 18th international century across formats, taking her past former Australia captain Meg Lanning for the most centuries in women's international cricket.</p>\n\n<h2>India's bowlers close the door on Hong Kong, China</h2>\n<p>Hong Kong, China faced a target of 194 but were unable to build sustained partnerships against an Indian attack that maintained pressure throughout the chase.</p>\n<p>Deepti Sharma led the bowling effort with three wickets for nine runs. Nandni Sharma, Prema Rawat and Sree Charani added two wickets each as India completed a convincing victory.</p>\n\n<h2>Second straight win puts India on top of Group A</h2>\n<p>The result gave India their second win in succession at the tournament and moved them to the top of Group A. India had earlier opened their campaign with a 94-run win over Thailand.</p>\n<p>With the top two teams from each group advancing to the semi-finals, every Group A result remains important as the competition moves toward its knockout stage.</p>\n\n<h2>Pakistan next for India</h2>\n<p>India's next Group A assignment is against Pakistan on 5 September. The fixture will be their first meeting since the ICC Women's T20 World Cup 2026 and will be one of the headline matches of the group stage.</p>\n<p>Mandhana's form gives India a major boost heading into that contest, while the bowling unit will also take confidence from another disciplined performance.</p>",
  "sources": [
    {
      "label": "ICC - Mandhana smashes multiple records with spectacular ton",
      "url": "https://www.icc-cricket.com/news/mandhana-surpasses-historic-milestones-in-asia-cup"
    },
    {
      "label": "ICC - All the squads at the Women's Asia Cup 2026",
      "url": "https://www.icc-cricket.com/news/all-the-squads-at-the-women-s-asia-cup-2026"
    },
    {
      "label": "ICC - Pakistan confirm squads for Asia Cup and Asian Games",
      "url": "https://www.icc-cricket.com/news/pakistan-confirm-squads-for-asia-cup-and-asian-games"
    }
  ],
  "relatedArticles": [
    {
      "title": "India Women vs Hong Kong, China: Asia Cup 2026 Preview",
      "url": "articles/india-women-vs-hong-kong-asia-cup-2026-preview.html",
      "summary": "Read the match preview, key players and Group A context ahead of India's meeting with Hong Kong, China."
    },
    {
      "title": "India Women Open Asia Cup 2026 with Win Over Thailand",
      "url": "articles/india-women-asia-cup-2026-thailand-win-hong-kong-next.html",
      "summary": "India began their Women's Asia Cup campaign with a 94-run victory over Thailand."
    }
  ],
  "cardHeadline": "Mandhana's 124 Powers India Past Hong Kong, China",
  "cardSummary": "Smriti Mandhana smashed 124 off 64 balls as India registered their second straight Women's Asia Cup 2026 victory.",
  "homepageFeatured": true
}