{
  "slug": "india-women-win-asia-cup-2026-title",
  "seoTitle": "India Women Win Asia Cup 2026, Beat Sri Lanka by 72 Runs",
  "headline": "India Women Win Record Eighth Asia Cup Title After 72-Run Victory Over Sri Lanka",
  "metaDescription": "India Women beat Sri Lanka by 72 runs in Dubai to win the Women's Asia Cup 2026. Shafali Verma scored 68 before Sree Charani took four wickets.",
  "categoryLabel": "Women's Asia Cup 2026 • Final",
  "filterCategories": [
    "india",
    "icc"
  ],
  "articleType": "match-report",
  "deck": "Shafali Verma and Smriti Mandhana powered India to 183/5 before the spin attack bowled Sri Lanka out for 111 in the Dubai final.",
  "publicationDatetime": "2026-09-14T09:30:00+05:30",
  "heroImageFilename": "india-women-win-asia-cup-2026-title-cricxz.webp",
  "heroImageAlt": "CricXZ editorial graphic celebrating India Women's record eighth Asia Cup title after beating Sri Lanka by 72 runs",
  "heroImageWidth": 1536,
  "heroImageHeight": 1024,
  "heroImageCaption": "CricXZ editorial illustration of India's Women's Asia Cup 2026 title celebration.",
  "sourceCutoff": "Match details checked through 14 September 2026 after the final in Dubai.",
  "articleBodyHtml": "<p>India Women completed an unbeaten Women's Asia Cup 2026 campaign by defeating Sri Lanka Women by 72 runs in the final at the Dubai International Cricket Stadium on 13 September.</p>\n\n<p>After choosing to bat first, India posted 183 for five from 20 overs. Shafali Verma struck 68 and Smriti Mandhana made 59 before India's bowlers dismissed Sri Lanka for 111. The victory gave India a record-extending eighth Women's Asia Cup title.</p>\n\n<h2>India Women vs Sri Lanka Women final score</h2>\n<p><strong>India Women:</strong> 183/5 in 20 overs</p>\n<p><strong>Sri Lanka Women:</strong> 111 all out in 20 overs</p>\n<p><strong>Result:</strong> India Women won by 72 runs</p>\n<p><strong>Venue:</strong> Dubai International Cricket Stadium, Dubai</p>\n<p><strong>Date:</strong> 13 September 2026</p>\n\n<h2>Shafali Verma and Smriti Mandhana set up the victory</h2>\n<p>India's openers took control of the final from the start. Mandhana and Shafali carried India to 57 without loss at the end of the powerplay, giving the innings both stability and scoring momentum.</p>\n\n<p>Shafali reached her half-century from only 24 balls, the fastest fifty in Women's T20 Asia Cup history. Her 68 was the third half-century of her tournament and her second in succession.</p>\n\n<p>Mandhana completed a 35-ball fifty and continued to rotate the strike while punishing loose deliveries. The pair added 130 for the opening wicket before 17-year-old Chamudi Praboda dismissed Shafali in the 13th over.</p>\n\n<p>Mandhana was then run out for 59 from 39 balls. Sri Lanka slowed India's scoring through the closing overs and took three wickets for seven runs during one phase, but G Kamalini's late six helped India finish on 183 for five.</p>\n\n<h2>Sri Lanka make a positive start to the chase</h2>\n<p>Sri Lanka needed 184 to retain the title they won against India in the 2024 final. Imesha Dulani struck a boundary from the first ball, but Kranti Gaud responded in the same over by bowling her.</p>\n\n<p>Captain Chamari Athapaththu and Vishmi Gunarathne then added 58 for the second wicket. Their partnership kept Sri Lanka in the contest, but the required run rate continued to rise against India's disciplined attack.</p>\n\n<h2>Deepti Sharma triggers the decisive collapse</h2>\n<p>Deepti Sharma changed the direction of the chase in the tenth over. She had Athapaththu stumped by Richa Ghosh and dismissed Gunarathne two balls later, leaving Sri Lanka 63 for three.</p>\n\n<p>Those wickets removed the two set batters and allowed India's spinners to attack the middle order. Sri Lanka were unable to rebuild quickly enough as the target moved further out of reach.</p>\n\n<h2>Sree Charani takes four wickets</h2>\n<p>Sree Charani broke the partnership between Harshitha Samarawickrama and Nilakshika Silva with a sharp return catch. She then struck twice in three deliveries in her next over, dismissing Kavisha Dilhari and Silva as Sri Lanka slipped to 102 for six.</p>\n\n<p>Charani claimed her fourth wicket when Nandni Sharma completed a diving catch to remove Sugandika Kumari. Shafali also contributed with the ball by dismissing Hasini Perera, while Prema Rawat removed Mithali Ayodhya.</p>\n\n<p>Deepti completed the result by bowling Kaushini Nuthyangana. Sri Lanka were all out for 111, confirming India's 72-run victory.</p>\n\n<h2>India finish the tournament unbeaten</h2>\n<p>India won all five of their matches at the Women's Asia Cup 2026. They topped Group A after victories over Thailand, Hong Kong, China and Pakistan before beating Bangladesh by 40 runs in the first semi-final.</p>\n\n<p>The final brought India's most complete performance of the tournament. The opening pair supplied a 130-run foundation, the bowlers broke Sri Lanka's strongest partnership, and the spin attack closed the match without allowing a late recovery.</p>\n\n<p>Shafali finished the competition with 236 runs from five innings and three half-centuries. Her aggressive batting at the top of the order was central to India's unbeaten run.</p>\n\n<h2>India win a record eighth Women's Asia Cup title</h2>\n<p>The result extended India's record to eight Women's Asia Cup championships and marked their tenth consecutive appearance in the final.</p>\n\n<p>It also reversed the outcome of the 2024 title match, when Sri Lanka defeated India in Dambulla to win their first Women's Asia Cup. Two years later in Dubai, India regained the trophy with a dominant all-round display.</p>\n\n<p>Harmanpreet Kaur's side set high standards throughout the competition and delivered its strongest performance on the biggest night. A 72-run final victory completed an unbeaten campaign and returned India to the top of Asian women's cricket.</p>",
  "sources": [
    {
      "label": "ICC — India cruise to record-extending eighth Women's Asia Cup title",
      "url": "https://www.icc-cricket.com/news/india-cruise-to-record-extending-eighth-women-s-asia-cup-title"
    },
    {
      "label": "The Indian Express — India beat Sri Lanka by 72 runs in Women's Asia Cup 2026 final",
      "url": "https://indianexpress.com/article/sports/cricket/india-beat-sri-lanka-by-72-runs-in-womens-asia-cup-2026-final-in-dubai-10876663/"
    }
  ],
  "relatedArticles": [
    {
      "title": "India Women Beat Bangladesh by 40 Runs to Reach the Asia Cup Final",
      "url": "articles/india-women-vs-bangladesh-asia-cup-2026-semifinal-preview.html"
    },
    {
      "title": "India Women Beat Pakistan by 7 Wickets in Women's Asia Cup 2026",
      "url": "articles/india-women-vs-pakistan-asia-cup-2026-result.html"
    },
    {
      "title": "Mandhana's Record 124 Powers India Past Hong Kong, China",
      "url": "articles/smriti-mandhana-124-india-hong-kong-asia-cup-2026.html"
    }
  ],
  "cardHeadline": "India Women Win Record Eighth Asia Cup Title",
  "cardSummary": "India beat Sri Lanka by 72 runs in Dubai after Shafali Verma's 68 and Sree Charani's four-wicket haul.",
  "homepageFeatured": true
}
