{
  "slug": "india-women-asia-cup-2026-thailand-win-hong-kong-next",
  "seoTitle": "India Women Beat Thailand by 94 Runs in Asia Cup 2026",
  "headline": "India Women Open Asia Cup 2026 With 94-Run Win Over Thailand, Hong Kong Clash Next",
  "metaDescription": "India Women beat Thailand by 94 runs in the Women's Asia Cup 2026 as Shafali Verma scored 64 and Deepti Sharma starred with 3/0 in Dubai.",
  "categoryLabel": "India Women • Women's Asia Cup 2026",
  "filterCategories": [
    "india",
    "icc"
  ],
  "articleType": "match-report",
  "deck": "Shafali Verma's attacking 64 powered India to 159/9 before Deepti Sharma and Nandni Sharma led a dominant bowling display against Thailand in Dubai.",
  "publicationDatetime": "2026-09-01T15:50:00+05:30",
  "heroImageFilename": "india-women-asia-cup-2026-thailand-win-hong-kong-next-cricxz.webp",
  "heroImageAlt": "CricXZ editorial graphic showing India Women celebrating their 94-run Women's Asia Cup 2026 victory over Thailand",
  "heroImageWidth": 1672,
  "heroImageHeight": 941,
  "heroImageCaption": "CricXZ editorial graphic for India's 94-run win over Thailand in the Women's Asia Cup 2026.",
  "articleBodyHtml": "<p class=\"article-lead\">India Women made a convincing start to their Women's Asia Cup 2026 campaign with a 94-run victory over Thailand in Dubai, combining Shafali Verma's aggressive batting with a disciplined bowling performance.</p>\n\n<h2>Shafali Verma sets the tone for India</h2>\n<p>India finished their 20 overs at 159/9, with Shafali Verma providing the standout innings. The opener struck 64 from 36 balls, hitting eight fours and three sixes as India built early momentum.</p>\n<p>India were strongly placed during the first half of the innings but Thailand fought back with the ball. A cluster of wickets prevented India from turning their fast start into a much larger total, with Thailand's bowlers keeping the contest alive heading into the chase.</p>\n\n<h2>India's bowlers take control</h2>\n<p>Thailand were unable to build the partnerships required to challenge India's total and were dismissed for 65. Deepti Sharma delivered an exceptional spell of 3/0, while Nandni Sharma finished with 3/18 as India maintained pressure throughout the innings.</p>\n<p>The 94-run margin gave India a comfortable opening victory and an early boost in Group A. The performance also showed India's bowling depth after the batting unit had lost momentum during the latter part of its innings.</p>\n\n<h2>What India will take from the Thailand match</h2>\n<p>The biggest positive was Shafali's ability to attack from the top of the order and adapt to the Dubai conditions. India's bowlers then ensured there was no realistic route back into the match for Thailand.</p>\n<p>At the same time, the middle and lower-order collapse gives India an area to review before facing stronger opposition later in the tournament. Converting dominant starts into bigger totals could become increasingly important as the competition progresses.</p>\n\n<h2>Hong Kong, China next for India</h2>\n<p>India's next Group A assignment is against Hong Kong, China on 3 September. India are grouped with Thailand, Hong Kong, China and Pakistan, with the top two sides from each group progressing to the semi-finals.</p>\n<p>After beginning with a comprehensive win, India now have an opportunity to build further momentum before their later group-stage challenges.</p>",
  "sourceCutoff": "Information checked through 1 September 2026.",
  "sources": [
    {
      "label": "ICC — Experienced India ease past Thailand despite stumble",
      "url": "https://www.icc-cricket.com/news/experienced-india-ease-past-thailand-despite-stumble"
    },
    {
      "label": "ICC — All the squads at the Women's Asia Cup 2026",
      "url": "https://www.icc-cricket.com/news/all-the-squads-at-the-women-s-asia-cup-2026"
    }
  ],
  "relatedArticles": [
    {
      "title": "India vs Sri Lanka 2nd Test 2026",
      "url": "articles/india-vs-sri-lanka-2nd-test-2026.html",
      "summary": "Read CricXZ's recent coverage of India in international cricket."
    }
  ],
  "homepageFeatured": true
}