{
  "slug": "india-women-vs-hong-kong-asia-cup-2026-preview",
  "seoTitle": "India Women vs Hong Kong Asia Cup 2026: Match Preview",
  "headline": "India Women vs Hong Kong, China: Women's Asia Cup 2026 Match Preview",
  "metaDescription": "India Women face Hong Kong, China in the Women's Asia Cup 2026 on September 3. Preview the Group A clash, key players, form and qualification context.",
  "categoryLabel": "India Women • Women's Asia Cup 2026",
  "filterCategories": [
    "india",
    "icc"
  ],
  "articleType": "feature",
  "deck": "India look to build on their 94-run opening victory over Thailand when they face Natasha Miles-led Hong Kong, China in their next Group A challenge.",
  "publicationDatetime": "2026-09-03T14:40:00+05:30",
  "heroImageFilename": "india-women-vs-hong-kong-asia-cup-2026-preview-cricxz.webp",
  "heroImageAlt": "CricXZ editorial graphic for the India Women versus Hong Kong, China Women's Asia Cup 2026 match preview",
  "heroImageWidth": 1672,
  "heroImageHeight": 941,
  "heroImageCaption": "CricXZ editorial graphic for India Women's Group A meeting with Hong Kong, China at the Women's Asia Cup 2026.",
  "articleBodyHtml": "<p class=\"article-lead\">India Women return to action in the Women's Asia Cup 2026 on 3 September when they face Hong Kong, China in Group A. Harmanpreet Kaur's side enter the contest after a commanding 94-run victory over Thailand, while the match provides another opportunity to build momentum in the race for the semi-finals.</p>\n\n<h2>India arrive with momentum after Thailand win</h2>\n<p>India began their campaign by posting 159/9 against Thailand before dismissing their opponents for 65. Shafali Verma led the batting effort with an attacking 64 from 36 balls, including eight fours and three sixes.</p>\n<p>The bowling performance was even more decisive. Deepti Sharma finished with remarkable figures of 3/0 and Nandni Sharma took 3/18 as India shut down Thailand's chase and completed a 94-run victory.</p>\n\n<h2>India still have batting areas to improve</h2>\n<p>The opening result was comprehensive, but it also gave India something to review. After a strong start, the batting innings lost momentum as Thailand fought back with regular wickets. Shafali acknowledged after the match that India would assess where the batting unit could improve.</p>\n<p>That makes the Hong Kong, China game useful not only in terms of Group A points but also as another opportunity for India's batting order to find greater consistency before the later stages of the competition.</p>\n\n<h2>Shafali Verma will again be central to India's plans</h2>\n<p>Shafali's ability to attack during the powerplay was one of the biggest positives from India's opener. She also spoke about adapting to the Dubai conditions, noting that the newer ball comes on better before the surface can become more difficult as the ball gets older.</p>\n<p>India will therefore look for another positive start while aiming to build stronger partnerships through the middle overs. Captain Harmanpreet Kaur, vice-captain Smriti Mandhana, Deepti Sharma and wicketkeeper-batter Richa Ghosh are among the experienced options in India's Asia Cup squad.</p>\n\n<h2>Hong Kong, China players to watch</h2>\n<p>Hong Kong, China are captained by Natasha Miles, one of their most experienced batters. ICC squad information listed Miles with more than 2,000 T20I runs when the tournament squad was announced.</p>\n<p>Mariko Hill entered the tournament as Hong Kong, China's leading T20I run-scorer, while Chan Ka Ying is their leading wicket-taker. Those experienced players give Hong Kong, China important options as they attempt to challenge India's batting and bowling depth.</p>\n\n<h2>Pratika Rawal part of India's updated squad</h2>\n<p>India entered the tournament without Jemimah Rodrigues after the batter was ruled out with a high-grade right hamstring tear. The BCCI named Pratika Rawal as her replacement for the Women's Asia Cup.</p>\n<p>The updated squad remains led by Harmanpreet Kaur with Smriti Mandhana as vice-captain and includes Shafali Verma, Deepti Sharma, Richa Ghosh, Renuka Thakur, Radha Yadav, Nandni Sharma and other established and emerging options.</p>\n\n<h2>Why the Group A contest matters</h2>\n<p>India and Hong Kong, China are in Group A alongside Pakistan and Thailand. Under the tournament format, the top two teams from each group progress to the semi-finals.</p>\n<p>India's opening victory has given them an encouraging platform, but maintaining momentum is important with further group-stage challenges ahead. For Hong Kong, China, facing India represents an opportunity to test themselves against one of the tournament's strongest squads.</p>\n\n<h2>What to expect from India vs Hong Kong, China</h2>\n<p>India will begin as the stronger side on paper, but their priority will be producing a complete performance rather than relying on individual contributions. A more stable batting effort combined with the bowling discipline shown against Thailand would put India in a strong position.</p>\n<p>Hong Kong, China will look to their experienced core, particularly Natasha Miles, Mariko Hill and Chan Ka Ying, to create pressure and make India work for control of the contest.</p>\n<p>For India, the match is another chance to strengthen their Group A campaign and sharpen their game before the business end of the Women's Asia Cup 2026.</p>",
  "sourceCutoff": "Information checked through 3 September 2026 before the match.",
  "sources": [
    {
      "label": "ICC — Experienced India ease past Thailand despite stumble",
      "url": "https://www.icc-cricket.com/news/experienced-india-ease-past-thailand-despite-stumble"
    },
    {
      "label": "ICC — Hong Kong, China name squad for Women's Asia Cup",
      "url": "https://www.icc-cricket.com/news/hong-kong-china-name-squad-for-women-s-asia-cup"
    },
    {
      "label": "ICC — All the squads at the Women's Asia Cup 2026",
      "url": "https://www.icc-cricket.com/news/all-the-squads-at-the-women-s-asia-cup-2026"
    },
    {
      "label": "BCCI — Jemimah Rodrigues ruled out of Asia Cup and Asian Games",
      "url": "https://www.bcci.tv/news/article/jemimah-rodrigues-ruled-out-asia-cup-and-asian-games"
    }
  ],
  "relatedArticles": [
    {
      "title": "India Women Open Asia Cup 2026 With 94-Run Win Over Thailand",
      "url": "articles/india-women-asia-cup-2026-thailand-win-hong-kong-next.html",
      "summary": "Read how India began their Women's Asia Cup 2026 campaign with a convincing victory over Thailand."
    }
  ],
  "cardHeadline": "India Women vs Hong Kong, China: Asia Cup 2026 Preview",
  "cardSummary": "India face Hong Kong, China on September 3 after opening their Women's Asia Cup campaign with a 94-run victory over Thailand.",
  "homepageFeatured": true
}
