{
  "slug": "england-beat-sri-lanka-first-odi-2026",
  "seoTitle": "England Beat Sri Lanka by 89 Runs as Will Jacks Takes Five",
  "headline": "England Beat Sri Lanka by 89 Runs as Will Jacks Takes 5/22",
  "metaDescription": "England beat Sri Lanka by 89 runs in the first ODI at Chester-le-Street. Will Jacks scored 46 and took 5/22 after Harry Brook made 67.",
  "categoryLabel": "England vs Sri Lanka 2026 • 1st ODI",
  "filterCategories": ["icc", "odi"],
  "articleType": "match-report",
  "deck": "Will Jacks followed an unbeaten 46 with his maiden ODI five-wicket haul as England defended 265 and dismissed Sri Lanka for 176.",
  "publicationDatetime": "2026-09-23T08:30:00+05:30",
  "heroImageFilename": "england-beat-sri-lanka-first-odi-2026-cricxz.webp",
  "heroImageAlt": "CricXZ result graphic showing England's 89-run first ODI victory over Sri Lanka and Will Jacks' five-wicket haul",
  "heroImageWidth": 1536,
  "heroImageHeight": 1024,
  "heroImageCaption": "CricXZ editorial illustration of England's first ODI victory over Sri Lanka at Chester-le-Street.",
  "sourceCutoff": "Match details checked after the result on 22 September 2026.",
  "articleBodyHtml": "<p>England opened the three-match ODI series against Sri Lanka with an 89-run victory at Chester-le-Street on 22 September 2026.</p>\n\n<p>Captain Harry Brook top-scored with 67 as England made 265 from 48.1 overs. Will Jacks then transformed the match with the ball, taking a career-best 5/22 as Sri Lanka were dismissed for 176 in 37 overs.</p>\n\n<h2>England vs Sri Lanka first ODI score</h2>\n<p><strong>England:</strong> 265 all out in 48.1 overs</p>\n<p><strong>Sri Lanka:</strong> 176 all out in 37 overs</p>\n<p><strong>Result:</strong> England won by 89 runs</p>\n<p><strong>Venue:</strong> Riverside Ground, Chester-le-Street</p>\n<p><strong>Date:</strong> 22 September 2026</p>\n<p><strong>Player of the Match:</strong> Will Jacks</p>\n\n<h2>Harry Brook leads England to 265</h2>\n<p>England chose to bat but lost Tom Banton for 10 with the score on 16. Ben Duckett responded with 32 from 29 balls before Dunith Wellalage trapped him lbw, leaving England 67 for two.</p>\n\n<p>Joe Root and Brook rebuilt with a controlled third-wicket partnership. Root made 44 from 52 balls, while Brook scored 67 from 69 deliveries with seven fours. Their work gave England a platform on a surface that offered assistance to Sri Lanka's bowlers.</p>\n\n<p>Brook departed with England 182 for four, and Jos Buttler followed for 31. Debutant leg-spinner Sachindu Colombage impressed by taking 3/44, including the wickets of Root, Buttler and Jamie Overton.</p>\n\n<h2>Will Jacks provides valuable lower-order runs</h2>\n<p>Jacks held England's innings together through the closing overs. He finished unbeaten on 46 from 47 balls and struck four consecutive boundaries in the 48th over to push the total beyond 260.</p>\n\n<p>Asitha Fernando claimed 3/53 and completed the innings by bowling Josh Tongue. England were all out for 265 with 11 deliveries unused, leaving Sri Lanka a target of 266.</p>\n\n<h2>England apply early pressure in the chase</h2>\n<p>Sri Lanka reached 27 without loss before Gus Atkinson dismissed Kamindu Mendis for 14. Josh Tongue then removed Pathum Nissanka for 27, reducing the visitors to 48 for two.</p>\n\n<p>Pavan Rathnayake and captain Kusal Mendis attempted to rebuild, but Jamie Overton broke the partnership. Sri Lanka were 84 for three before Jacks entered the attack and quickly changed the match.</p>\n\n<h2>Will Jacks takes maiden ODI five-wicket haul</h2>\n<p>Jacks trapped Charith Asalanka lbw for one and later removed Kusal Mendis for 42. Those wickets left Sri Lanka 105 for six and forced the lower order to attempt a steep recovery.</p>\n\n<p>Dunith Wellalage counterattacked with 45 from 36 balls, hitting five fours and two sixes. He carried Sri Lanka to 176 before Jacks had him caught by Jamie Overton.</p>\n\n<p>Jacks dismissed Asitha Fernando two balls later and bowled Dilshan Madushanka with the final delivery of his seventh over. Sri Lanka lost their final three wickets without adding a run as Jacks completed figures of 5/22.</p>\n\n<h2>Complete all-round performance earns Player of the Match</h2>\n<p>Jacks' unbeaten 46 was England's second-highest score and prevented the innings from ending below a competitive total. His maiden ODI five-wicket haul then turned a useful contribution into a decisive match-winning performance.</p>\n\n<p>Jamie Overton supported him with 2/21, while Atkinson, Tongue and Rehan Ahmed took one wicket each. England dismissed Sri Lanka with 13 overs remaining.</p>\n\n<h2>England take 1-0 lead in three-match ODI series</h2>\n<p>The 89-run result gave England a 1-0 advantage after their 3-0 T20I series victory over Sri Lanka. For Sri Lanka, Colombage's debut spell and Wellalage's late innings were the strongest positives from the match.</p>\n\n<p>The second ODI is scheduled at Headingley on 24 September, where Sri Lanka will attempt to keep the series alive and England will have an opportunity to secure it.</p>\n\n<p><em>Match information checked after the completed first ODI on 22 September 2026.</em></p>",
  "sources": [
    {
      "label": "NDTV Sports — England vs Sri Lanka first ODI scorecard",
      "url": "https://sports.ndtv.com/apps/cricket/live-scores/ensl09222026264920?template=scorecard"
    },
    {
      "label": "The Guardian — England v Sri Lanka first ODI report",
      "url": "https://www.theguardian.com/sport/live/2026/sep/22/england-v-sri-lanka-first-one-day-cricket-international-live-score-updates"
    }
  ],
  "relatedArticles": [
    {
      "title": "India Edge Japan by 2 Runs in Historic T20I",
      "url": "articles/india-vs-japan-historic-t20i-2026.html"
    },
    {
      "title": "India Women Beat Japan to Reach Asian Games Semi-final",
      "url": "articles/india-women-beat-japan-asian-games-2026-semifinal.html"
    },
    {
      "title": "Latest Cricket News",
      "url": "pages/news.html"
    }
  ],
  "cardHeadline": "England Beat Sri Lanka by 89 Runs in 1st ODI",
  "cardSummary": "Will Jacks scored an unbeaten 46 and took 5/22 after Harry Brook's 67 helped England post 265.",
  "homepageFeatured": true
}
