{
  "slug": "india-women-vs-pakistan-women-asia-cup-2026-preview",
  "seoTitle": "India Women vs Pakistan Women Asia Cup 2026: Match Preview",
  "headline": "India Women vs Pakistan Women: Women's Asia Cup 2026 Match Preview",
  "metaDescription": "India Women face Pakistan Women on 5 September in the Women's Asia Cup 2026. Check current form, key players and the Group A context before the clash.",
  "categoryLabel": "India Women • Women's Asia Cup 2026",
  "filterCategories": [
    "india",
    "icc"
  ],
  "articleType": "news",
  "deck": "India and Pakistan meet in a high-profile Group A contest in Dubai, with both sides carrying winning form into the Women's Asia Cup 2026 clash.",
  "publicationDatetime": "2026-09-04T11:30:00+05:30",
  "heroImageFilename": "india-women-vs-pakistan-women-asia-cup-2026-preview-cricxz.webp",
  "heroImageAlt": "Editorial graphic for India Women vs Pakistan Women in the Women's Asia Cup 2026 in Dubai",
  "heroImageWidth": 1536,
  "heroImageHeight": 1024,
  "sourceCutoff": "Information checked through 4 September 2026.",
  "articleBodyHtml": "<p>India Women and Pakistan Women are set to meet on 5 September in one of the most anticipated Group A matches of the Women's Asia Cup 2026 in Dubai. India enter the contest after winning their opening two matches, while Pakistan also began their campaign with a victory.</p>\n\n<h2>India carry winning momentum into Pakistan clash</h2>\n<p>India opened their Women's Asia Cup 2026 campaign with a 94-run victory over Thailand. Shafali Verma struck 64 from 36 balls before India's bowlers took control, with Deepti Sharma returning three wickets without conceding a run and Nandni Sharma taking three wickets for 18.</p>\n<p>India followed that result with another commanding performance against Hong Kong, China. Smriti Mandhana scored 124 from 64 balls as India posted 193 for five. The innings included 14 fours and seven sixes, while Deepti Sharma later claimed three wickets for nine runs as India completed their second consecutive victory.</p>\n\n<h2>Mandhana and Shafali give India a major top-order threat</h2>\n<p>India's opening pair will be one of the key areas to watch against Pakistan. Shafali made an immediate impact against Thailand, while Mandhana produced a record-breaking century in the following match.</p>\n<p>Mandhana's innings against Hong Kong, China also carried historic significance. According to the ICC, she moved to 10,880 international runs, surpassing Mithali Raj's 10,868 to become the leading run-scorer in women's international cricket. It was also her 18th international century.</p>\n\n<h2>Pakistan arrive with confidence after winning start</h2>\n<p>Pakistan also opened their Women's Asia Cup campaign with a victory, defeating Thailand by 35 runs. Muneeba Ali scored 54 as Pakistan built a total their bowlers were able to defend.</p>\n<p>Pakistan's bowling attack, particularly its spin options, gives the side an important weapon in Dubai conditions. Ahead of the India match, the Pakistan camp has highlighted disciplined bowling, changes of pace and adapting to the surface as important parts of its approach.</p>\n\n<h2>Key players to watch in India vs Pakistan</h2>\n<p>For India, Mandhana and Shafali provide attacking options at the top of the order, while Deepti Sharma has already made a significant impact with the ball. India's bowling depth was also evident in the victory over Hong Kong, China.</p>\n<p>Pakistan will look towards Muneeba Ali for runs at the top, while captain Fatima Sana and the team's spin resources can play important roles with the ball. Nashra Sundhu and Sadia Iqbal are among Pakistan's experienced bowling options in the tournament squad.</p>\n\n<h2>Group A context makes the contest important</h2>\n<p>India, Pakistan, Thailand and Hong Kong, China make up Group A of the Women's Asia Cup 2026. The top two teams from each group advance to the semi-finals, making every group-stage result important in the race for the knockout phase.</p>\n<p>India's two victories have given them a strong start to the tournament, while Pakistan entered the India fixture with confidence after beginning their campaign with a win.</p>\n\n<h2>India vs Pakistan: what to watch</h2>\n<p>The contest brings together an in-form Indian batting unit and a Pakistan attack that will look to use spin, variation and disciplined bowling effectively. India's ability to maintain its aggressive top-order approach against Pakistan's bowling options could be one of the defining battles of the match.</p>\n<p>With a major rivalry, valuable Group A points and a place in the knockout-stage race all adding context, the 5 September meeting is set to be one of the standout fixtures of the Women's Asia Cup 2026 group stage.</p>",
  "sources": [
    {
      "label": "ICC — All the squads at the Women's Asia Cup 2026",
      "url": "https://www.icc-cricket.com/news/all-the-squads-at-the-women-s-asia-cup-2026"
    },
    {
      "label": "ICC — Experienced India ease past Thailand despite stumble",
      "url": "https://www.icc-cricket.com/news/experienced-india-ease-past-thailand-despite-stumble"
    },
    {
      "label": "ICC — Mandhana surpasses historic milestones in Asia Cup",
      "url": "https://www.icc-cricket.com/news/mandhana-surpasses-historic-milestones-in-asia-cup"
    },
    {
      "label": "ICC — Pakistan off to a winning start in Asia Cup",
      "url": "https://www.icc-cricket.com/news/pakistan-off-to-a-winning-start-in-asia-cup"
    },
    {
      "label": "ICC — Belief rising as Pakistan turn attention to India at Asia Cup",
      "url": "https://www.icc-cricket.com/news/belief-rising-as-pakistan-turn-attention-to-india-at-asia-cup"
    }
  ],
  "relatedArticles": [
    {
      "title": "Mandhana's Record 124 Powers India Past Hong Kong, China",
      "url": "articles/smriti-mandhana-124-india-hong-kong-asia-cup-2026.html"
    },
    {
      "title": "India Women Open Asia Cup 2026 With Win Over Thailand",
      "url": "articles/india-women-asia-cup-2026-thailand-win-hong-kong-next.html"
    }
  ],
  "cardHeadline": "India Women vs Pakistan Women: Asia Cup 2026 Preview",
  "cardSummary": "India and Pakistan meet on 5 September after making winning starts to the Women's Asia Cup 2026.",
  "homepageFeatured": true
}